单位名称,最终得分,技术标总得分,商务标总得分,技术标评委1,技术标评委2,技术标评委3,技术标评委4,技术标评委5
山东省地矿工程勘察院,89.42,59.74,29.68,59.9,59.7,59.7,59.7,59.7
山东省城乡建设勘察设计研究院,92.12,63.44,28.68,63.2,63.4,63.4,63.4,63.8
北京城建勘测设计研究院有限责任公司,89.82,59.86,29.96,60.1,59.8,59.8,59.8,59.8
山东省鲁南地质工程勘察院,76.25,54.62,21.63,55.5,54.4,54.4,54.4,54.4
山东省交通规划设计院,88.14,58.46,29.68,58.7,58.4,58.4,58.4,58.4
济南市勘察测绘研究院,90.45,62.6,27.85,62.9,62.6,62.6,62.6,62.3
山东正元建设工程有限责任公司,90.74,60.94,29.8,61.1,60.9,60.9,60.9,60.9
山东电力工程咨询院有限公司,79.45,57.38,22.07,57.7,57.3,57.3,57.3,57.3
中国有色金属工业西安勘察设计研究院,85.21,59.92,25.29,60,59.9,59.9,59.9,59.9
